{
  "$schema": "https://json-schema.org/draft/2020-12/schema",
  "$id": "https://nova.factory/prd.schema.json",
  "title": "Nova Factory PRD",
  "description": "Schema for prd.json — the structured product spec emitted by the Plan Lambda. Single source of truth consumed by RalphTurn, Validate, Review, and the postdeploy probe.",
  "type": "object",
  "required": [
    "feature_id",
    "title",
    "narrative_md",
    "stories",
    "scope",
    "hard_blockers",
    "risk_flags",
    "suggested_split"
  ],
  "additionalProperties": false,
  "properties": {
    "feature_id": {
      "type": "string",
      "minLength": 1,
      "description": "Notion page UUID."
    },
    "title": {
      "type": "string",
      "minLength": 1
    },
    "narrative_md": {
      "type": "string",
      "description": "The full Notion body, markdown."
    },
    "stories": {
      "type": "array",
      "minItems": 1,
      "items": {
        "type": "object",
        "required": ["id", "description", "acceptance_criteria", "passes"],
        "additionalProperties": false,
        "properties": {
          "id": {
            "type": "string",
            "pattern": "^s[1-9][0-9]*$"
          },
          "description": {
            "type": "string",
            "minLength": 1
          },
          "acceptance_criteria": {
            "type": "array",
            "minItems": 1,
            "items": {
              "type": "string",
              "minLength": 1
            }
          },
          "passes": {
            "type": "boolean"
          }
        }
      }
    },
    "scope": {
      "type": "object",
      "required": ["touches_db", "touches_frontend", "touches_infra", "files_in_scope"],
      "additionalProperties": false,
      "properties": {
        "touches_db":       { "type": "boolean" },
        "touches_frontend": { "type": "boolean" },
        "touches_infra":    { "type": "boolean" },
        "files_in_scope": {
          "type": "array",
          "items": { "type": "string", "minLength": 1 }
        }
      }
    },
    "hard_blockers": {
      "type": "array",
      "items": {
        "type": "object",
        "required": ["reason"],
        "additionalProperties": false,
        "properties": {
          "reason": {
            "type": "string",
            "enum": [
              "feature_too_large",
              "non_free_tier_resource_unconfirmed",
              "ambiguous_requirements"
            ]
          },
          "details": { "type": "string" },
          "suggested_split": {
            "type": "array",
            "items": { "type": "string", "minLength": 1 }
          }
        }
      }
    },
    "risk_flags": {
      "type": "array",
      "items": { "type": "string", "minLength": 1 }
    },
    "suggested_split": {
      "type": "array",
      "items": { "type": "string", "minLength": 1 },
      "description": "Populated only when sizing rubric is breached. Each entry is a one-line description of a sub-feature the human should re-file as Ready-to-Build."
    }
  }
}
