{
  "feature_id": "3560930a-bc71-811f-9588-e01ac8ae7322",
  "title": "Factory v2 cutover smoke health endpoint version",
  "narrative_md": "# Factory v2 cutover smoke \u2013 health endpoint version\n\n## Description\n\nAdd a tiny GET /api/health-info endpoint returning {\"factory_generation\": \"v2\", \"cutover_at\": \"2026-05-04\"}.\n\n## Tech Notes\n\nMirror /api/version-v2 pattern. Update docs/openapi.json. No auth.\n\n## Acceptance Criteria\n\n- 200 with the JSON body when called without auth\n- docs/openapi.json includes /api/health-info\n\n## Out of Scope\n\nAuthentication; metric collection",
  "stories": [
    {
      "id": "s1",
      "description": "Add GET /api/health-info endpoint",
      "acceptance_criteria": [
        "200 with the JSON body when called without auth"
      ],
      "passes": false
    },
    {
      "id": "s2",
      "description": "Update OpenAPI schema",
      "acceptance_criteria": [
        "docs/openapi.json includes /api/health-info"
      ],
      "passes": false
    }
  ],
  "scope": {
    "touches_db": false,
    "touches_frontend": false,
    "touches_infra": false,
    "files_in_scope": [
      "app/api/health.py",
      "docs/openapi.json"
    ]
  },
  "hard_blockers": [],
  "risk_flags": [],
  "suggested_split": []
}